,ID,title,abstract,date,doi,author_corresponding,author_corresponding_institution,source,eligible,new
305,32610334,COVID-19 Infection and Neurological Complications: Present Findings and Future Predictions.,"The present outbreak caused by SARS-CoV-2, an influenza virus with neurotropic potential, presents with neurological manifestations in a large proportion of the affected individuals. Disorders of the central and peripheral nervous system are all present, while stroke, ataxia, seizures, and depressed level of consciousness are more common in severely affected patients. People with these severe complications are most likely elderly with medical comorbidities, especially hypertension and other vasc",27/08/2020,10.1159/000508991,Ettore Beghi,"Department of Neuroscience, Istituto di Ricerche Farmacologiche Mario Negri IRCCS, Milan, Italy, ettore.beghi@marionegri",pubmed,0,0
306,32607526,Cost Benefit Analysis of Limited Reopening Relative to a Herd Immunity Strategy or Shelter in Place for SARS-CoV-2 in the United States.,"Fierce debate about the health and financial tradeoffs presented by different COVID-19 pandemic mitigation strategies highlights the need for rigorous quantitative evaluation of policy options. To quantify the economic value of the costs and benefits of a policy of continued limited reopening with social distancing relative to alternative COVID-19 response strategies in the United States. We estimate the number and value of quality-adjusted life-years (QALY) gained from mortality averted, with a",28/09/2020,10.1101/2020.06.26.20141044,Robert B Schonberger,NA,pubmed,0,0
307,32607505,COVID-19 Clinical Research.,"While the global COVID-19 pandemic has challenged the entire humanity and health systems, it also triggered researchers to urgently perform clinical trials to assess the safety and efficacy of many agents and modalities to combat COVID-19. As of April 22, over 650 clinical studies have been registered both in USA and internationally. Results from these studies are also coming at a brisk pace in this unprecedented emergency. We searched the NCI website and Medline and summarize various national a",28/09/2020,10.33696/Signaling.1.006,Jeffrey Chi,"Northwell Health Cancer Institute, Donald and Barbara Zucker School of Medicine at Hofstra, Feinstein Institute for Medical Research, Lake Success, NY, USA",pubmed,0,0
308,32605278,Exploring Sodium Glucose Co-Transporter-2 (SGLT2) Inhibitors for Organ Protection in COVID-19.,"Hospital admissions and mortality from the Coronavirus disease 2019 (COVID-19) pandemic are spreading throughout the world, and second and third waves are thought to be likely. Risk factors for severe COVID-19 include diabetes, chronic kidney disease and cardiovascular disease. Currently, there is no vaccine and no approved therapy. Therapeutic approaches are aimed at preventing viral replication and spread, limiting the impact of the inflammatory overdrive (cytokine storm), preventing thromboem",28/09/2020,10.3390/jcm9072030,Beatriz Fernandez-Fernandez,"IIS-Fundaci..n Jim..nez Diaz, Department of Medicine, School of Medicine, Universidad Aut..noma de Madrid, 28029 Madrid, Spain",pubmed,0,0
309,32604775,A Comprehensive Analysis of Clinical Trials in the COVID-19 Pandemic Era.,"Background and objective: Despite medical advances, we are facing the unprecedented disaster of the coronavirus disease 2019 (COVID-19) pandemic without available treatments and effective vaccines. As the COVID-19 pandemic has approached its culmination, desperate efforts have been made to seek proper treatments and response strategies, and the number of clinical trials has been rapidly increasing. In this time of the pandemic, it is believed that learning lessons from it would be meaning",07/07/2020,10.3390/medicina56060315,Jinhee Lee,"Department of Psychiatry, Yonsei University, Wonju College of Medicine, Wonju Kangwon 26426, Korea",pubmed,0,0
310,32601655,Enhancing global health communication during a crisis: lessons from the COVID-19 pandemic.,"The understanding and practice of public health crisis communication are improved through the study of responses to past crises, but require retooling for present challenges. The 'Addressing Ebola and other outbreaks' checklist contains guiding principles built upon maxims developed from a World Health Organization consultation in response to the mad cow (bovine spongiform encephalopathy) crisis that were later adopted for Ebola. The purpose of this article is to adapt the checklist for the heal",06/07/2020,10.17061/phrp3022010,Scott C Ratzan,"CUNY Graduate School of Public Health and Health Policy, City University of New York, US",pubmed,0,0
311,32600908,"Emerging manufacturers engagements in the COVID -19 vaccine research, development and supply.","The World Health Organization declared the COVID-19 disease as a pandemic requiring a rapid response. Through online search, direct communication with network members and an internal survey, engagements of developing countries' vaccine manufacturers' network members in the research and development of COVID-19 vaccines and their capacities in the manufacturing, fill-finish and distribution of vaccines were assessed. Currently, 19 network members engaged in research and development of COVID-19 vac",20/07/2020,10.1016/j.vaccine.2020.06.022,Sonia Pagliusi,"DCVMN International, Route de Crassier 7, 1262 Eysins-Nyon, Switzerland. Electronic address: s.pagliusi@dcvmn",pubmed,0,0
312,32591957,"Once we have it, will we use it? A European survey on willingness to be vaccinated against COVID-19.",NA,20/08/2020,10.1007/s10198-020-01208-6,Sebastian Neumann-B..hme,"Erasmus School of Health Policy and Management, Erasmus University Rotterdam, Rotterdam, The Netherlands. neumann@eshpm.eur",pubmed,0,0
313,32584199,Human and novel coronavirus infections in children: a review.,"Coronaviruses, seven of which are known to infect humans, can cause a spectrum of clinical presentations ranging from asymptomatic infection to severe illness and death. Four human coronaviruses (hCoVs)-229E, HKU1, NL63 and OC43-circulate globally, commonly infect children and typically cause mild upper respiratory tract infections. Three novel coronaviruses of zoonotic origin have emerged during the past two decades: severe acute respiratory syndrome coronavirus (SARS-CoV-1), Middle East respir",25/06/2020,10.1080/20469047.2020.1781356,Nipunie Rajapakse,"Division of Pediatric Infectious Diseases, Department of Pediatric and Adolescent Medicine, Mayo Clinic , Rochester, MN, USA",pubmed,0,0
314,32577668,"Improving Precision and Power in Randomized Trials for COVID-19 Treatments Using Covariate Adjustment, for Binary, Ordinal, and Time-to-Event Outcomes.",Time is of the essence in evaluating potential drugs and biologics for the treatment and prevention of COVID-19. There are currently over 400 clinical trials (phase 2 and 3) of treatments for COVID-19 registered on clinicaltrials.gov. Covariate adjustment is a statistical analysis method with potential to improve precision and reduce the required sample size for a substantial number of these trials. Though covariate adjustment is recommended by the U.S. Food and Drug Administration and the Europ,29/09/2020,10.1101/2020.04.19.20069922,David Benkeser,"Department of Biostatistics and Bioinformatics, Emory University",pubmed,0,0
315,32577634,SARS-CoV-2 mRNA Vaccine Development Enabled by Prototype Pathogen Preparedness.,"A SARS-CoV-2 vaccine is needed to control the global COVID-19 public health crisis. Atomic-level structures directed the application of prefusion-stabilizing mutations that improved expression and immunogenicity of betacoronavirus spike proteins. Using this established immunogen design, the release of SARS-CoV-2 sequences triggered immediate rapid manufacturing of an mRNA vaccine expressing the prefusion-stabilized SARS-CoV-2 spike trimer (mRNA-1273). Here, we show that mRNA-1273 induces both po",28/09/2020,10.1101/2020.06.11.145920,Kizzmekia S Corbett,Vaccine Research Center,pubmed,0,0
316,32575350,Merit of an Ursodeoxycholic Acid Clinical Trial in COVID-19 Patients.,"Corona Virus Disease 2019 (COVID-19) has affected over 8 million people worldwide. We underscore the potential benefits of conducting a randomized open-label unblinded clinical trial to evaluate the role of ursodeoxycholic acid (UDCA) in the treatment of COVID-19. Some COVID-19 patients are characterized with cytokine storm syndrome that can cause severe and irreversible damage to organs leading to multi-organ failure and death. Therefore, it is critical to control both programmed cell death (ap",28/09/2020,10.3390/vaccines8020320,Subbaya Subramanian,"Department of Surgery, University of Minnesota, Minneapolis, MN 55455, USA",pubmed,0,0
317,32574267,COVID-19 and SARS Coronavirus 2: Antibodies for the Immediate Rescue and Recovery Phase.,NA,10/07/2020,10.3389/fimmu.2020.01196,Scott B Halstead,"Independent Researcher, Bethesda, MD, United States",pubmed,0,0
318,32574236,Available Evidence and Ongoing Clinical Trials of Remdesivir: Could It Be a Promising Therapeutic Option for COVID-19?,"The novel coronavirus strain, severe acute respiratory syndrome coronavirus-2, the causative agent of COVID-19 emerged in Wuhan, China, in December 2019 and is skyrocketing throughout the globe and become a global public health emergency. Despite promising preventive measures being taken, there is no vaccine or drug therapy officially approved to prevent or treat the infection. Everybody is waiting the findings of ongoing clinical trials in various chemical and biological products. This review i",28/09/2020,10.3389/fphar.2020.00791,Mekonnen Sisay,"Department of Pharmacology and Toxicology, School of Pharmacy, College of Health and Medical Sciences, Haramaya University, Harar, Ethiopia",pubmed,0,0
319,32571773,"Oseltamivir for coronavirus illness: post-hoc exploratory analysis of an open-label, pragmatic, randomised controlled trial in European primary care from 2016 to 2018.","Patients infected with the novel coronavirus (SARS-CoV-2) are being treated empirically with oseltamivir, but there is little evidence from randomised controlled trials to support the treatment of coronavirus infections with oseltamivir. To determine whether adding oseltamivir to usual care reduces time to recovery in symptomatic patients who have tested positive for coronavirus (not including SARS-CoV-2). Exploratory analysis of data from an open-label, pragmatic, randomised controlled trial du",17/07/2020,10.3399/bjgp20X711941,Samuel Coenen,"Centre for General Practice, Department of Family Medicine &amp",pubmed,0,0
320,32571007,Nanotechnology for COVID-19: Therapeutics and Vaccine Research.,The current global health threat by the novel coronavirus disease 2019 (COVID-19) requires an urgent deployment of advanced therapeutic options available. The role of nanotechnology is highly relevant to counter this &quot;virus&quot; nano enemy. Nano intervention is discussed in terms of designing effective nanocarriers to counter the conventional limitations of antiviral and biological therapeutics. This strategy directs the safe and effective delivery of available therapeutic options using en,01/09/2020,10.1021/acsnano.0c04006,Gaurav Chauhan,"School of Engineering and Sciences, Tecnologico de Monterrey, Av. Eugenio Garza Sada 2501 Sur, 64849 Monterrey, Nuevo Le..n, Mexico",pubmed,0,0
321,32567818,Respiratory viral coinfection in a birth cohort of infants in rural Nepal.,"Acute respiratory illnesses are a leading cause of global morbidity and mortality in children. Coinfection with multiple respiratory viruses is common. Although the effects of each virus have been studied individually, the impacts of coinfection on disease severity are less understood. A secondary analysis was performed of a maternal influenza vaccine trial conducted between 2011 and 2014 in Nepal. Prospective weekly household-based active surveillance of infants was conducted from birth to 180.",22/06/2020,10.1111/irv.12775,Anne Emanuels,"Department of Epidemiology, University of Washington, Seattle, WA, USA",pubmed,0,0
322,32565096,"Anticipating Severe Acute Respiratory Syndrome Coronavirus 2 Vaccine Testing, Licensure, and Recommendations for Use.",NA,11/09/2020,10.1016/j.jpeds.2020.06.048,Kathryn M Edwards,"Division of Infectious Diseases, Vanderbilt University Medical Center, Nashville, TN. Electronic address: Kathryn.edwards@vumc",pubmed,0,0
323,32563999,"Origin, transmission, diagnosis and management of coronavirus disease 2019 (COVID-19).","Coronavirus has emerged as a global health threat due to its accelerated geographic spread over the last two decades. This article reviews the current state of knowledge concerning the origin, transmission, diagnosis and management of coronavirus disease 2019 (COVID-19). Historically, it has caused two pandemics: severe acute respiratory syndrome and Middle East respiratory syndrome followed by the present COVID-19 that emerged from China. The virus is believed to be acquired from zoonotic sourc",10/07/2020,10.1136/postgradmedj-2020-138234,Srikanth Umakanthan,"Paraclinical Sciences, The University of the West Indies at Saint Augustine Faculty of Medical Sciences, Saint Augustine, Trinidad and Tobago Srikanth.Umakanthan@sta.uwi.edu dr.u.srikanth@gmail",pubmed,0,0
324,32563940,Analyzing barriers for implementation of public health and social measures to prevent the transmission of COVID-19 disease using DEMATEL method.,"COVID-19 is a contagious disease caused by a new coronavirus known as severe acute respiratory syndrome coronavirus 2 (SARS-CoV-2). Till now there are no vaccines and explicit medicines available for the treatment of COVID-19 disease, therefore the initiatives like public health and social measures are helpful in limiting the quantity of contaminations and saving lives. Keeping this in view, an attempt has been made in the present work to identify the barriers which hinder the implementation of ",28/09/2020,10.1016/j.dsx.2020.06.024,Annayath Maqbool,"Department of Mechanical Engineering, National Institute of Technology Srinagar, Jammu and Kashmir, 190006, India. Electronic address: annayat_13phd19@nitsri",pubmed,0,0
325,32563547,Autoinflammatory and autoimmune conditions at the crossroad of COVID-19.,"Coronavirus disease 2019 (COVID-19) has been categorized as evolving in overlapping phases. First, there is a viral phase that may well be asymptomatic or mild in the majority, perhaps 80% of patients. The pathophysiological mechanisms resulting in minimal disease in this initial phase are not well known. In the remaining 20% of cases, the disease may become severe and/or critical. In most patients of this latter group, there is a phase characterized by the hyperresponsiveness of the immune syst",09/09/2020,10.1016/j.jaut.2020.102506,Yhojan Rodr..guez,"Center for Autoimmune Diseases Research (CREA), School of Medicine and Health Sciences, Universidad del Rosario, Bogota, Colombia",pubmed,0,0
326,32562594,Pregnant Women in Trials of Covid-19: A Critical Time to Consider Ethical Frameworks of Inclusion in Clinical Trials.,"Ethical issues abound during this unprecedented international public health crisis of Covid-19. While the trade-off between societal and individual interests that occurs at the intersection of public health ethics and clinical ethics affects all populations, this calculus has particular relevance for pregnant women and the question of when they will have access to new Covid-19 therapies and vaccines. Pregnant women are a &quot;scientifically complex&quot; population whose inclusion in clinical r",27/07/2020,10.1002/eahr.500060,Ruth Farrell,Vice chair of research in the OB/GYN &amp,pubmed,0,0
327,32562316,A proposed role for the SARS-CoV-2 nucleocapsid protein in the formation and regulation of biomolecular condensates.,"To date, the recently discovered SARS-CoV-2 virus has afflicted &gt;6.9 million people worldwide and disrupted the global economy. Development of effective vaccines or treatments for SARS-CoV-2 infection will be aided by a molecular-level understanding of SARS-CoV-2 proteins and their interactions with host cell proteins. The SARS-CoV-2 nucleocapsid (N) protein is highly homologous to the N protein of SARS-CoV, which is essential for viral RNA replication and packaging into new virions. Emerging",11/09/2020,10.1096/fj.202001351,Sean M Cascarina,"Department of Biochemistry and Molecular Biology, Colorado State University, Fort Collins, CO, USA",pubmed,0,0
328,32561657,Could an Unrelated Live Attenuated Vaccine Serve as a Preventive Measure To Dampen Septic Inflammation Associated with COVID-19 Infection?,"We propose the concept that administration of an unrelated live attenuated vaccine, such as MMR (measles, mumps, rubella), could serve as a preventive measure against the worst sequelae of coronavirus disease 2019 (COVID-19). There is mounting evidence that live attenuated vaccines provide nonspecific protection against lethal infections unrelated to the target pathogen of the vaccine by inducing &quot;trained&quot; nonspecific innate immune cells for improved host responses against subsequent i",29/06/2020,10.1128/mBio.00907-20,Paul L Fidel,"Department of Oral and Craniofacial Biology, Louisiana State University Health-School of Dentistry, New Orleans, Louisiana, USA pfidel@lsuhsc",pubmed,0,0
329,32557771,How to expedite early-phase SARS-CoV-2 vaccine trials in pandemic setting-A practical perspective.,NA,02/07/2020,10.1111/bcp.14435,Johan L van der Plas,"Centre for Human Drug Research (CHDR), Leiden, The Netherlands",pubmed,0,0
331,32554572,Pandemic vaccines are about to face the real test.,NA,08/07/2020,10.1126/science.368.6497.1295,Jon Cohen,NA,pubmed,0,0
332,32548679,Calling for an exponential escalation scheme in vaccine development for COVID-19.,"COVID-19 as a pandemic calls for rapid development of vaccines. Here a proposal of a seamless, adaptive, phase 1-3 trial for accelerated vaccine development is described. Starting at 10, the number of vaccinated volunteers would exponentially increase by tenfold at an interval of 2..weeks; close surveillance of antibody responses, safety and efficacy is necessary. After only 16..weeks, general vaccination would be feasible if supply meets the demand. A COVID-19 vaccine would be rapidly available",23/09/2020,10.1007/s00228-020-02933-w,Martin Wehling,"Institute of Clinical Pharmacology Mannheim, Medical Faculty Mannheim, University of Heidelberg, Theodor-Kutzer-Ufer 1-3, 68167, Mannheim, Germany. martin.wehling@medma.uni-heidelberg",pubmed,0,0
333,32544799,Immune checkpoint inhibitors: a physiology-driven approach to the treatment of coronavirus disease 2019.,"While confirmed cases of the deadly coronavirus disease 2019 (COVID-19) have exceeded 4.7 million globally, scientists are pushing forward with efforts to develop vaccines and treatments in an attempt to slow the pandemic and lessen the disease's damage. Although no proven effective therapies for treating patients with COVID-19 or for managing their complications currently exist, the rapidly expanding knowledge regarding severe acute respiratory syndrome coronavirus 2 and its interplay with host",28/07/2020,10.1016/j.ejca.2020.05.026,Serena Di Cosimo,"Biomarker Unit, Department of Applied Research and Technological Development, Fondazione IRCCS Istituto Nazionale Dei Tumori, Milano, Italy",pubmed,0,0
334,32540733,Metabolic syndrome and COVID-19: An update on the associated comorbidities and proposed therapies.,"Many patients with coronavirus disease 2019 (COVID-19) have comorbidities related to metabolic syndrome (MS) during the disease course. Its presence in different ethnicities and continents places MS as an important risk factor for COVID-19. Adequate understanding of the interplay between MS, COVID-19 and proposed therapies is required for optimum management of these patients. We systematically searched the PubMed and Google Scholar databases until June 1st, 2020 and accessed the full text on COV",24/09/2020,10.1016/j.dsx.2020.06.016,Fernanda Farias Costa,"Department of Biomedicine, CEUMA University (UNICEUMA), R. Bar..o do Rio Branco, 100, Entroncamento, Imperatriz, MA, 65903-093, Brazil",pubmed,0,0
335,32540367,A review of potential treatments to date in COVID-19 patients according to the stage of the disease.,"Since the end of 2019, the COVID-19 pandemic has affected millions of people worldwide. With the rapid spread of this virus, an immense burden has fallen upon both healthcare and economic systems. As a consequence, there is an unprecedented urgency for researchers and scientific committees from all over the world to find an effective treatment and vaccine. Many potential therapies are currently under investigation, with some, like Hydroxychloroquine, being authorized for emergency use in some co",02/09/2020,10.1016/j.retram.2020.05.004,Tamim Alsuliman,"Service d'H..matologie, h..pital Saint-Antoine, AP-HP, Sorbonne Universit.., 75012, Paris, France. Electronic address: dr.tameem.soliman@gmail",pubmed,0,0
336,32535032,Vitamin D receptor stimulation to reduce acute respiratory distress syndrome (ARDS) in patients with coronavirus SARS-CoV-2 infections: Revised Ms SBMB 2020_166.,"Coronavirus infection is a serious health problem awaiting an effective vaccine and/or antiviral treatment. The major complication of coronavirus disease 2019 (COVID-19), the Acute Respiratory Distress syndrome (ARDS), is due to a variety of mechanisms including cytokine storm, dysregulation of the renin-angiotensin system, neutrophil activation and increased (micro)coagulation. Based on many preclinical studies and observational data in humans, ARDS may be aggravated by vitamin D deficiency and",14/09/2020,10.1016/j.jsbmb.2020.105719,Jose Manuel Quesada-Gomez,"Instituto Maim..nides de Investigaci..n Biom..dica de C..rdoba (IMIBIC). Hospital Universitario Reina Sof..a, Universidad de C..rdoba, Fundaci..n Progreso y Salud, Avda. Men..ndez Pidal s/n, 14004, C..rdoba, Spain",pubmed,0,0
337,32529703,The WetNet: What the Oral Polio Vaccine Hypothesis Exposes about Globalized Interspecies Fluid Bonds.,"The author analyzes the aftermath of Edward..Hooper's suggestion that the trial of an oral polio vaccine (OPV) in the Belgian colonies of Africa engendered the pandemic form of the AIDS virus, HIV-1. In response to..Hooper's book,..The River (1999),..the Royal Society in London held a conference to debate the origins of HIV. Examination of the quick dismissal of the OPV theory opens a space for legitimately challenging the widely held belief that the vaccine contamination question was convincing",04/08/2020,10.1111/maq.12587,S Lochlann Jain,"Department of Anthropology, Stanford University",pubmed,0,0
338,32527823,Aggregating data from COVID-19 trials.,NA,17/06/2020,10.1126/science.abc8993,Elizabeth L Ogburn,"Bloomberg School of Public Health, Johns Hopkins University, Baltimore, MD 21205, USA. eogburn@jhsph",pubmed,0,0
339,32527819,Can existing live vaccines prevent COVID-19?,NA,17/06/2020,10.1126/science.abc4262,Konstantin Chumakov,"Office of Vaccines Research and Review, Center for Biologics Evaluation and Research, Food and Drug Administration, Silver Spring, MD, USA. konstantin.chumakov@fda.hhs",pubmed,0,0
340,32527804,"COVID-19 and flu, a perfect storm.",NA,17/06/2020,10.1126/science.abd2220,Edward A Belongia,"Edward A. Belongia is the director of the Center for Clinical Epidemiology and Population Health, Marshfield Clinic Research Institute, Marshfield, WI, USA. belongia.edward@marshfieldclinic",pubmed,0,0
341,32525830,A vaccine is not too far for COVID-19.,NA,22/06/2020,10.3855/jidc.12744,Shailesh Kumar Patel,"Division of Pathology, ICAR-Indian Veterinary Research Institute, Bareilly, Uttar Pradesh, India. shaileshpatel624@gmail",pubmed,0,0
342,32520683,Review on the Clinical Pharmacology of Hydroxychloroquine Sulfate for the Treatment of COVID-19.,"As the number of severe acute respiratory syndrome coronavirus 2 (SARS-COV-2) infected people is greatly increasing worldwide, the international medical situation becomes very serious. Potential therapeutic drugs, vaccine and stem cell replacement methods are emerging, so it is urgent to find specific therapeutic drugs and the best treatment regimens. After the publications on hydroxychloroquine (HCQ) with anti- SARS-COV-2 activity in vitro, a small, non-randomized, open-label clinical trial sho",08/10/2020,10.2174/1389200221666200610172929,Cheng Cui,"Drug Clinical Trial Center, Peking University Third Hospital, Beijing 100191, China",pubmed,0,0
343,32515685,Dynamic surveillance of SARS-CoV-2 shedding and neutralizing antibody in children with COVID-19.,"Coronavirus disease 2019 (COVID-19) caused by severe acute respiratory syndrome coronavirus 2 (SARS-CoV-2) emerged in China and quickly spread globally. In this study, we investigated the characteristics of viral shedding from different sites and the neutralizing antibody (NAb) response during the acute and convalescent phases of nine children with COVID-19. SARS-CoV-2 was detected in their nasopharyngeal swabs (9/9, 100%), stool samples (8/9, 89%), and oropharyngeal swabs (3/9, 33%) but was not",12/06/2020,10.1080/22221751.2020.1772677,Pengcheng Liu,"Department of Clinical Laboratory, Children's Hospital of Fudan University, Shanghai, People's Republic of China",pubmed,0,0
