,ID,title,abstract,date,doi,author_corresponding,author_corresponding_institution,source,eligible,new
79,15226,The SARS-CoV-2 effective reproduction rate has a high correlation with a contact index derived from large-scale individual location data using GPS-enabled mobile phones in Germany,"The novel coronavirus (SARS-CoV-2), which was first discovered in Hubei, China in December 2019, has caused an ongoing pandemic. Due to pauci-symptomatic cases, the virus may spread invisibly in a community. In the absence of vaccination, non-pharmaceutical interventions (NPIs) like interpersonal distancing were implemented in several countries and have been key to effectively reduce viral spreading. In Germany after an exponential growth of case numbers in March 2020, NPIs were able to effectively control the pandemic and sufficiently reduced the daily reported new infections allowing for partial release of NPIs. We developed a novel statistical method to evaluate contacts between individuals, which is essential for virus transmission. We derived the contact index, an index for the intensity and heterogeneity of contact behavior from spatial proximity between individuals as proxy for physical interaction based on complex network science. We estimated the contact index from large-scale GPS mobile phone data of 1.15 to 1.4 million users in Germany per day (March to July 2020). A high correlation between the contact index and the effective reproduction number six days later could be observed (Pearson correlation r=0.96, P-value < 0.001 for all reported Pearson correlations). This correlation was observed in three different phases of the virus spread in Germany 1) the early phase of the first wave with the highest reproduction rate, 2) phase of strict NPIs (lockdown) with the lowest reproduction, 3) release of NPIs accompanied with an increase of reproduction. The results show that the contact index is able to model and potentially forecast the time evolution of the pandemic in Germany.",09/10/2020,10.1101/2020.10.02.20188136,Sten Ruediger,NET CHECK GmbH,medrxiv,0,0
92,33024977,Molecular Architecture of Early Dissemination and Massive Second Wave of the SARS-CoV-2 Virus in a Major Metropolitan Area.,"We sequenced the genomes of 5,085 SARS-CoV-2 strains causing two COVID-19 disease waves in metropolitan Houston, Texas, an ethnically diverse region with seven million residents. The genomes were from viruses recovered in the earliest recognized phase of the pandemic in Houston, and an ongoing massive second wave of infections. The virus was originally introduced into Houston many times independently. Virtually all strains in the second wave have a Gly614 amino acid replacement in the spike prot",10/10/2020,10.1101/2020.09.22.20199125,Scott Wesley Long,NA,pubmed,0,0
100,33009361,A 63-Year-Old Woman with a History of Non-Hodgkin Lymphoma with Persistent SARS-CoV-2 Infection Who Was Seronegative and Treated with Convalescent Plasma.,"BACKGROUND This is a case report of an immunocompromised patient with a history of non-Hodgkin lymphoma and persistent severe acute respiratory syndrome coronavirus 2 (SARS-CoV-2) infection who was seronegative and successfully treated with convalescent plasma. CASE REPORT A 63-year-old woman with a past medical history of non-Hodgkin lymphoma in remission while on maintenance therapy with the anti-CD20 monoclonal antibody, obinutuzumab, tested positive for SARS-CoV-2 via nasopharyngeal reverse ",05/10/2020,10.12659/AJCR.927812,Joanna L Moore,"Department of Medicine, Norwalk Hospital, Norwalk, CT, USA",pubmed,0,0
101,33002475,SARS-CoV-2 infection serology validation of different methods: Usefulness of IgA in the early phase of infection.,"A novel coronavirus (SARS-CoV-2) was isolated from the respiratory samples of patients with pneumonia as showed by the sequence analysis of the virus genomes obtained in Wuhan, China. The antibody response to SARS-CoV-2 is not well understood yet, but the availability of sensitive and specific serological assays will be crucial for the early diagnosis of infection, for epidemiological studies and for defining the presence of neutralizing antibodies in response to a possible vaccine. We tested an",10/10/2020,10.1016/j.cca.2020.09.033,Massimo Pieri,"Department of Experimental Medicine, University of Tor Vergata, Rome, Italy",pubmed,0,0
102,33000193,[Comment] COVID...19 vaccine safety.,"In response to the SARS...CoV...2 outbreak, and the resulting COVID...19 pandemic, a global competition to develop an anti...COVID...19 vaccine has ensued. The targeted time frame for initial vaccine deployment is late 2020. The present article examines whether short...term, mid...term, and long...term vaccine safety can be achieved under such an accelerated schedule, given the myriad vaccine...induced mechanisms that have demonstrated adverse effects based on previous clinical trials and labora",03/10/2020,10.3892/ijmm.2020.4733,Ronald N Kostoff,"School of Public Policy, Georgia Institute of Technology, Gainesville, VA 20155, USA",pubmed,0,0
103,32998488,Status of COVID-19 vaccine development.,"The pandemic caused by SARS-CoV-2 has created a global humanitarian and economic crisis for which there is currently no solution in sight. Much hope has therefore been pinned on a vaccine that can protect against the disease COVID-19. As of August 2020, the World Health Organization has registered 173 vaccine candidates as being in development. Six candidates have entered phase 3 trials, and the first results from these are expected in the autumn.",07/10/2020,10.4045/tidsskr.20.0676,Arne Michael Taxt,NA,pubmed,0,0
106,32995807,How the clinical research community responded to the COVID-19 pandemic: An analysis of the COVID-19 clinical studies in ClinicalTrials.gov.,"The novel coronavirus disease (COVID-19), broke out in December 2019, is a global pandemic. Rapidly in the past few months, a large number of clinical studies have been initiated worldwide to find effective therapeutics, vaccines, and preventive strategies. In this study, we aim to understand the landscape of COVID-19 clinical research and identify the gaps and issues that may cause difficulty in recruitment and the lack of population representativeness. We analyzed 2,034 COVID-19 studies regist",09/10/2020,10.1101/2020.09.16.20195552,Zhe He,NA,pubmed,0,0
109,32991604,Effectiveness of the non-pharmaceutical public health interventions against COVID-19; a protocol of a systematic review and realist review.,"Without any pharmaceutical intervention and vaccination, the only way to combat Coronavirus Disease 2019 (COVID-19) is to slow down the spread of the disease by adopting non-pharmaceutical public health interventions (PHIs). Patient isolation, lockdown, quarantine, social distancing, changes in health care provision, and mass screening are the most common non-pharmaceutical PHIs to cope with the epidemic. However, there is neither systematic evidence on the effectiveness of non-pharmaceutical PH",05/10/2020,10.1371/journal.pone.0239554,Shabnam Iezadi,"Hospital Management Research Center, Iran University of Medical Sciences, Tehran, Iran",pubmed,0,0
110,32991223,Considerations on the clinical development of COVID-19 vaccine from trial design perspectives.,"COVID-19 has become a global pandemic, and an effective vaccine is needed. During the outbreak, the urgency for developing candidate vaccines has brought distinct challenges to clinical development. An efficacy trial, which measures whether the vaccine reduces the incidence of disease, is ordinarily required to fully evaluate vaccine efficacy. However, emergency use may be possible if promising immunogenicity results are observed. A ring vaccination trial, which recruits subjects connected to a ",29/09/2020,10.1080/21645515.2020.1815489,Zhiwei Jiang,"Department of Biostatistics, Beijing KeyTech Statistical Consulting Co., Ltd , Beijing, China",pubmed,0,0
111,32988688,Intention to participate in a COVID-19 vaccine clinical trial and to get vaccinated against COVID-19 in France during the pandemic.,The world is facing the COVID-19 pandemic. The development of a vaccine is challenging. We aimed to determine the proportion of people who intend to get vaccinated against COVID-19 in France or to participate in a vaccine clinical trial. We conducted an anonymous on-line survey from the 26th of March to the 20th of April 2020. Primary endpoints were the intention to get vaccinated against COVID-19 if a vaccine was available or participate in a vaccine clinical trial. Three thousand two hundred a,09/10/2020,10.1016/j.vaccine.2020.09.041,Ma..lle Detoc,"Centre d'investigation clinique-INSERM 1408, University Hospital of Saint-Etienne, France",pubmed,0,0
112,32985963,Coronavirus Disease 2019 Vaccine Development: An Overview.,"To this day, the coronavirus disease 2019 (COVID-19) pandemic has not shown signs of abating. Moreover, the virus responsible for the pandemic, severe acute respiratory syndrome coronavirus 2, has evolved into three different variants. This phenomenon highlights an even greater need to develop drugs and vaccines to control the rate of infection and spread of the disease. As of July 7, 2020, at least 160 vaccine candidates, 21 of which have entered the clinical trial phase, have been developed. T",28/09/2020,10.1089/vim.2020.0119,Riyadi Sumirtanurdin,"Pharmacist Profession Education, Faculty of Pharmacy, Universitas Padjadjaran, Bandung, Indonesia",pubmed,0,0
113,32978962,"Improving precision and power in randomized trials for COVID-19 treatments using covariate adjustment, for binary, ordinal, and time-to-event outcomes.",Time is of the essence in evaluating potential drugs and biologics for the treatment and prevention of COVID-19. There are currently 876 randomized clinical trials (phase 2 and 3) of treatments for COVID-19 registered on clinicaltrials.gov. Covariate adjustment is a statistical analysis method with potential to improve precision and reduce the required sample size for a substantial number of these trials. Though covariate adjustment is recommended by the U.S. Food and Drug Administration and the,11/10/2020,10.1111/biom.13377,David Benkeser,"Department of Biostatistics and Bioinformatics, Emory University, Atlanta, Georgia, USA",pubmed,0,0
115,32974268,Overview of the First 6 Months of Clinical Trials for COVID-19 Pharmacotherapy: The Most Studied Drugs.,"SARS-CoV-2 rapidly spread from China until it was defined a pandemic by WHO in March 2020. Related scientific papers have rapidly extended information regarding the diagnosis, treatment and epidemiology of COVID-19 infection. To date, no vaccine or definitive treatment is available to defeat the virus and therapies are mainly based on existing drugs used to treat other conditions. Existing therapies used in several clinical trials work by affecting the biology of COVID-19 and/or counteracting th",28/09/2020,10.3389/fpubh.2020.00497,Maria Laura Idda,"Institute for Genetic and Biomedical Research, National Research Council, Sassari, Italy",pubmed,0,0
116,32973779,The 2020 Pandemic: Current SARS-CoV-2 Vaccine Development.,"Coronaviruses are enveloped viruses with a positive-sense single-stranded RNA genome infecting animals and humans. Coronaviruses have been described more than 70 years ago and contain many species. Severe Acute Respiratory Syndrome (SARS) and Middle East Respiratory Syndrome (MERS) are lethal species caused by human coronaviruses (HCoVs). Currently, a novel strain of HCoVs, named Severe Acute Respiratory Syndrome Coronavirus 2 (SARS-CoV-2) causes coronavirus disease 2019 (Covid-19). SARS-CoV-2 w",06/10/2020,10.3389/fimmu.2020.01880,Sana O Alturki,"Department of Microbiology and Immunology, Drexel University College of Medicine, Philadelphia, PA, United States",pubmed,0,0
117,32973505,"Repurposing Drugs, Ongoing Vaccine, and New Therapeutic Development Initiatives Against COVID-19.","As the COVID-19 is still growing throughout the globe, a thorough investigation into the specific immunopathology of SARS-CoV-2, its interaction with the host immune system and pathogen evasion mechanism may provide a clear picture of how the pathogen can breach the host immune defenses in elderly patients and patients with comorbid conditions. Such studies will also reveal the underlying mechanism of how children and young patients can withstand the disease better. The study of the immune defen",06/10/2020,10.3389/fphar.2020.01258,Rudra P Saha,"Department of Biotechnology, School of Life Science &amp",pubmed,0,0
118,32969973,Coronavirus disease-19 vaccine development utilizing promising technology.,"Coronavirus disease-19 (COVID-19) is a highly transmittable and pathogenic pneumonia-causing disease, which is caused by severe acute respiratory syndrome coronavirus-2, resulting in millions of deaths globally. Severe acute respiratory syndrome coronavirus-2 may coexist with human populations for a long time. Therefore, high-effective COVID-19 vaccines are an urgent need. Vaccines help in the development of long-lasting humoral or cellular immunity, or both, by exposing individuals to antigens ",07/10/2020,10.1097/COH.0000000000000648,Yihan Wang,"Department of Pathogen Biology, School of Basic Medical Sciences, Tianjin Medical University, Tianjin",pubmed,0,0
119,32969369,Safety and Efficacy of Different Therapeutic Interventions on Prevention and Treatment of COVID-19.,"Severe acute respiratory syndrome coronavirus 2 (SARS-CoV-2) is the strain of coronavirus that causes coronavirus disease 2019 (COVID-19), a respiratory illness. COVID-19 has now become a global public health crisis causing alarming numbers of morbidity and mortality. Ever since the COVID-19 pandemic started scientists, researchers, universities, companies, and institutions all around the world have been endeavoring to discover a potential treatment for COVID-19. Numerous studies and clinical tr",01/10/2020,10.33314/jnhrc.v18i2.2806,Pradip Gyanwali,"Nepal Health Research Council, Ramshah Path, Kathmandu, Nepal",pubmed,0,0
120,32967006,SARS-CoV-2 vaccines in development.,"Severe acute respiratory syndrome coronavirus 2 (SARS-CoV-2) was first reported in late 2019 in China and is the causative agent of the coronavirus disease 2019 (COVID-19) pandemic. To mitigate the effects of the virus on public health, the economy and society, a vaccine is urgently needed. Here I review the development of vaccines against SARS-CoV-2. Development was initiated when the genetic sequence of the virus became available in early January 2020, and has moved at an unprecedented speed: ",01/10/2020,10.1038/s41586-020-2798-3,Florian Krammer,"Department of Microbiology, Icahn School of Medicine at Mount Sinai, New York, NY, USA. florian.krammer@mssm",pubmed,0,0
121,32966315,"Multiple drivers of the COVID-19 spread: The roles of climate, international mobility, and region-specific conditions.","Following its initial appearance in December 2019, coronavirus disease 2019 (COVID-19) quickly spread around the globe. Here, we evaluated the role of climate (temperature and precipitation), region-specific COVID-19 susceptibility (BCG vaccination factors, malaria incidence, and percentage of the population aged over 65 years), and human mobility (relative amounts of international visitors) in shaping the geographical patterns of COVID-19 case numbers across 1,020 countries/regions, and examine",02/10/2020,10.1371/journal.pone.0239385,Yasuhiro Kubota,"Faculty of Science, University of the Ryukyus, Okinawa, Japan",pubmed,0,0
122,32966155,Preparatory phase for clinical trials of COVID-19 vaccine in Nepal.,"Public health data suggested a rapid rise in COVID-19-confirmed cases in Nepal along with increased deaths. There has been a wide variation in clinical outcomes of this disease. Control of this pandemic depends on the availability of vaccines or drugs for SARS-CoV-2. Thus, viral and human genetics/genomics and immunology are necessary to understand whether these factors will affect clinical trials of vaccines in Nepal.",23/09/2020,10.1080/21645515.2020.1809267,Govind Prasad Gupta,"Department of Clinical Microbiology, School of Physiotherapy and Paramedical Science, Lovely Professional University , Phagwara, India",pubmed,0,0
123,32963672,Expedited COVID-19 vaccine trials: a rat-race with challenges and ethical issues.,"The intense global efforts are directed towards development of vaccines to halt the COVID-19 virus pandemic. There are 160 candidate vaccines under clinical trials across the world using different molecular targets and techniques. This race for the vaccine has several challenges and ethical issues like compressed timelines, generation and proper management of resources and finances, risks to the participating volunteers due to curtailed research trial processes, geopolitical contentions, misinfo",30/09/2020,10.11604/pamj.2020.36.206.23977,Prathamesh Haridas Kamble,"Department of Physiology, All India Institute of Medical Sciences, Nagpur, India",pubmed,0,0
124,32961897,Induction of the Antiviral Immune Response and Its Circumvention by Coronaviruses.,"Some coronaviruses are zoonotic viruses of human and veterinary medical importance. The novel coronavirus, severe acute respiratory symptoms coronavirus 2 (SARS-CoV-2), associated with the current global pandemic, is characterized by pneumonia, lymphopenia, and a cytokine storm in humans that has caused catastrophic impacts on public health worldwide. Coronaviruses are known for their ability to evade innate immune surveillance exerted by the host during the early phase of infection. It is impor",28/09/2020,10.3390/v12091039,Ping Liu,"Key Laboratory of Fujian-Taiwan Animal Pathogen Biology, College of Animal Sciences (College of Bee Science), Fujian Agriculture and Forestry University, Fuzhou 350002, China",pubmed,0,0
125,32959618,Epidemic Landscape and Forecasting of SARS-CoV-2 in India.,"India was one of the countries to institute strict measures for Severe acute respiratory syndrome coronavirus 2 (SARS-CoV-2) control in the early phase. Since, then, the epidemic growth trajectory was slow before registering an explosion of cases due to local cluster transmissions. We estimated the growth rate and doubling time of SARS-CoV-2 for India and high burden states using crowdsourced time series data. Further, we also estimated the Basic Reproductive Number (R0) and Time-dependent Repro",22/09/2020,10.2991/jegh.k.200823.001,Aravind Lathika Rajendrakumar,"School of Medicine, University of Dundee, UK",pubmed,0,0
126,32958009,The use of mesenchymal stromal cells in the treatment of coronavirus disease 2019.,"More than seven months into the coronavirus disease -19 (COVID-19) pandemic, infection from the severe acute respiratory syndrome coronavirus-2 (SARS-CoV-2) has led to over 21.2 million cases and resulted in over 760,000 deaths worldwide so far. As a result, COVID-19 has changed all our lives as we battle to curtail the spread of the infection in the absence of specific therapies against coronaviruses and in anticipation of a proven safe and efficacious vaccine. Common with previous outbreaks of",02/10/2020,10.1186/s12967-020-02532-4,Maurice A Canham,"Tissues, Cells &amp",pubmed,0,0
127,32957894,Understanding the Role of Corona Virus based on Current Scientific Evidence - a Review with Emerging Important in Pandemic.,"Coronavirus disease is a potentially deadly disease and of significant apprehension for global communal health potentially because of its lethality. Vaccines and antiviral medications are still under trial to prevent or treat infections of human coronavirus (HCoV) till date. The virus HCoV originate in 2003, SARS-CoV, which causes respiratory syndrome having distinctive pathogenesis and causes infections of the respiratory tract. A mechanism was projected for the evolution of SARS virus and a ha",22/09/2020,10.2174/1574891X15999200918144833,Sukhes Mukherjee,"Associate Professor, Department of Biochemistry. All India Institute of Medical Sciences. Saket Nagar, Bhopal, Madhya pradesh-462020. India",pubmed,0,0
128,32955770,Cellular senescence as a potential mediator of COVID-19 severity in the elderly.,"SARS-CoV-2 is a novel betacoronavirus which infects the lower respiratory tract and can cause coronavirus disease 2019 (COVID-19), a complex respiratory distress syndrome. Epidemiological data show that COVID-19..has a rising mortality particularly in individuals with advanced age. Identifying a functional association between SARS-CoV-2 infection and the process of biological aging may provide a tractable avenue for therapy to prevent acute and long-term disease. Here, we discuss how cellular se",21/09/2020,10.1111/acel.13237,Jamil Nehme,"European Research Institute for the Biology of Ageing (ERIBA), University Medical Center Groningen (UMCG), University of Groningen (RUG, Groningen NL, The Netherlands",pubmed,0,0
129,32948465,"An update on COVID-19 infection control measures, plasma-based therapeutics, corticosteroid pharmacotherapy and vaccine research.","This communication provides a compilation on aspects of COVID-19 infection control measures, describes the potential role of therapeutic plasma exchange to reduce fatality rates, addresses precautions concerning dexamethasone pharmacotherapy and updates the current status on the availability of vaccines. As part of passive immunotherapy, it focuses on various blood derivatives. These include coronavirus neutralising antibodies extracted from different sources to be administered as a pure hyper c",01/10/2020,10.1016/j.transci.2020.102934,Jeffrey S Putter,"Medical Biomechanics Inc., 100 E. San Marcos Blvd., #400, San Marcos, North San Diego County), CA 92069, United States. Electronic address: Jputter@LTSP",pubmed,0,0
130,32946131,"Investigation of immune cells on elimination of pulmonary-Infected COVID-19 and important role of innate immunity, phagocytes.",We identified types of immune cells that contribute to clearing COVID-19 during the acute phase of the infection in mouse model and human. Our results suggest that both innate and adaptive immune responses are essential for controlling COVID-19 infection. Mild infection report of children by COVID-19 comparing adults' infection causes conclusion of higher resistance of immune system of children comparing adults. Our results show innate immune system including phagocytes contribute severely to th,09/10/2020,10.1002/rmv.2158,Esmaeil Farshi,R&amp,pubmed,0,0
131,32945335,Warp Speed for COVID-19 Vaccines: Why are Children Stuck in Neutral?,"While adult clinical trials of COVID-19 vaccines have moved quickly into Phase 3 clinical trials, clinical trials have not started in children in the US. The direct COVID-19 impact upon children is greater than that observed for a number of other pathogens for which we now have effective pediatric vaccines. Additionally, the role of children in SARS-CoV-2 transmission has clearly been underappreciated. Carefully conducted Phase II clinical trials can adequately address potential COVID-19 vaccine",09/10/2020,10.1093/cid/ciaa1425,Evan J Anderson,"Department of Pediatrics, Emory University School of Medicine, Atlanta, GA",pubmed,0,0
132,32943115,Using BCG vaccine to enhance non-specific protection of health care workers during the COVID-19 pandemic: A structured summary of a study protocol for a randomised controlled trial in Denmark.,"The Bacille Calmette-Gu..rin (BCG) vaccine against tuberculosis is associated with non- specific protective effects against other infections, and significant reductions in all-cause morbidity and mortality have been reported. We aim to test whether BCG vaccination may reduce susceptibility to and/or the severity of COVID-19 and other infectious diseases in health care workers (HCW) and thus prevent work absenteeism.The primary objective is to reduce absenteeism due to illness among HCW during th",23/09/2020,10.1186/s13063-020-04714-3,Anne Marie Rosendahl Madsen,"Bandim Health Project, OPEN, Department of Clinical Research, University of Southern Denmark/Odense University Hospital, Odense, Denmark. arosendahl@health.sdu",pubmed,0,0
133,32941801,Activate: Randomized Clinical Trial of BCG Vaccination against Infection in the Elderly.,"BCG vaccination in children protects against heterologous infections and improves survival independently of tuberculosis prevention. The phase III ACTIVATE trial assessed whether BCG has similar effects in the elderly. In this double-blind, randomized trial, elderly patients (n..= 198) received BCG or placebo vaccine at hospital discharge and were followed for 12..months for new infections. At interim analysis, BCG vaccination significantly increased the time to first infection (median 16..weeks",01/10/2020,10.1016/j.cell.2020.08.051,Evangelos J Giamarellos-Bourboulis,"(th) Department of Internal Medicine, National and Kapodistrian University of Athens, Medical School, 124 62 Athens, Greece. Electronic address: egiamarel@med.uoa",pubmed,0,0
134,32940090,"Potential effects of vaccinations on the prevention of COVID-19: rationale, clinical evidence, risks, and public health considerations.","Introduction Coronavirus disease (COVID-19), caused by severe acute respiratory syndrome coronavirus (SARS-CoV-2), has quickly spread around the world. Areas covered This review will discuss the available immunologic and clinical evidence to support the benefit of the influenza, pneumococcal, and tuberculosis vaccines in the context of COVID-19 as well as to provide an overview on the COVID-19-specific vaccines that are in the development pipeline. In addition, implications for vac",07/10/2020,10.1080/14760584.2020.1825951,Janet Sultana,"Department of Biomedical and Dental Sciences and Morphofunctional Imaging, University of Messina , Messina, Italy",pubmed,0,0
