,ID,title,abstract,date,doi,author_corresponding,author_corresponding_institution,source,eligible,new
24,7050,Symptomatic SARS-CoV-2 infections display specific IgG Fc structures,"The ongoing severe acute respiratory syndrome coronavirus 2 (SARS-CoV-2) pandemic has caused a public health crisis that is exacerbated by our poor understanding of correlates of immunity. SARS-CoV-2 infection can cause Coronavirus Disease 2019 (COVID-19), with a spectrum of symptoms ranging from asymptomatic carriage to life threatening pneumonia and cytokine dysregulation [1-3]. Although antibodies have been shown in a variety of in vitro assays to promote coronavirus infections through mechanisms requiring interactions between IgG antibodies and Fc gamma receptors (Fc{gamma}Rs), the relevance of these observations to coronavirus infections in humans is not known [4-7]. In light of ongoing clinical trials examining convalescent serum therapy for COVID-19 patients and expedited SARS-CoV-2 vaccine testing in humans, it is essential to clarify the role of antibodies in the pathogenesis of COVID-19. Here we show that adults with PCR-diagnosed COVID-19 produce IgG antibodies with a specific Fc domain repertoire that is characterized by reduced fucosylation, a modification that enhances interactions with the activating Fc{gamma}R, Fc{gamma}RIIIa. Fc fucosylation was reduced when compared with SARS-CoV-2-seropositive children and relative to adults with symptomatic influenza virus infections. These results demonstrate an antibody correlate of symptomatic SARS-CoV-2 infections in adults and have implications for novel therapeutic strategies targeting Fc{gamma}RIIIa pathways.",18/05/2020,10.1101/2020.05.15.20103341,Taia T. Wang,Stanford University,medrxiv,0,0
25,7431,Immunogenic profile of SARS-CoV-2 spike in individuals recovered from COVID-19,"The rapid global spread of SARS-CoV-2 and resultant mortality and social disruption have highlighted the need to better understand coronavirus immunity to expedite vaccine development efforts. Multiple candidate vaccines, designed to elicit protective neutralising antibodies targeting the viral spike glycoprotein, are rapidly advancing to clinical trial. However, the immunogenic properties of the spike protein in humans are unresolved. To address this, we undertook an in-depth characterisation of humoral and cellular immunity against SARS-CoV-2 spike in humans following mild to moderate SARS-CoV-2 infection. We find serological antibody responses against spike are routinely elicited by infection and correlate with plasma neutralising activity and capacity to block ACE2/RBD interaction. Expanded populations of spike-specific memory B cells and circulating T follicular helper cells (cTFH) were detected within convalescent donors, while responses to the receptor binding domain (RBD) constitute a minor fraction. Using regression analysis, we find high plasma neutralisation activity was associated with increased spike-specific antibody, but notably also with the relative distribution of spike-specific cTFH subsets. Thus both qualitative and quantitative features of B and T cell immunity to spike constitute informative biomarkers of the protective potential of novel SARS-CoV-2 vaccines.",21/05/2020,10.1101/2020.05.17.20104869,Adam K Wheatley,University of Melbourne,medrxiv,0,0
26,7905,Tensions between research and public health: modelling the risks and benefits of SARS-CoV-2 vaccine field trials versus human infection challenge studies.,"Background: Human infection challenge studies (HICS) with SARS-CoV-2 are under consideration as a way of accelerating vaccine development. We evaluate potential vaccine research strategies under a range of epidemic conditions determined, in part, by the intensity of public health interventions. Methods: We constructed a compartmental epidemiological model incorporating public health interventions, vaccine efficacy trials and a post-trial population vaccination campaign. The model was used to estimate the duration and benefits of large-scale field trials in comparison with HICS accompanied by an expanded safety trial, and to assess the marginal risk faced by HICS participants. Results: Field trials may demonstrate vaccine efficacy more rapidly than a HICS strategy under epidemic conditions consistent with moderate mitigation policies. A HICS strategy is the only feasible option for testing vaccine efficacy under epidemic suppression, and maximises the benefits of post-trial vaccination. Less successful or absent mitigation results in minimal or no benefit from post-trial vaccination, irrespective of trial design. Conclusions: SARS-CoV-2 HICS are the optimal method of vaccine testing for populations maintained under epidemic suppression, where vaccination offers the greatest benefits to the local population.",27/05/2020,10.1101/2020.05.18.20106187,George S Heriot,Monash University,medrxiv,0,0
27,7874,"Mechanistic rationale of drugs, Primary endpoints, Geographical distribution of clinical trials against Severe acute respiratory syndrome-related coronavirus-2: A Systematic Review","Objective To do a systematic review and critical appraisal of the ongoing clinical trials that are assessing various therapeutic interventions against SARS-CoV-2 with an aim to provide insight into the various interventions tested, clinical rationale, geographical distribution of the trials as well as the endpoints assessed in the studies. Design Rapid systematic review and critical appraisal of the ongoing clinical trials against SARS-CoV-2. Data sources ClinicalTrials.gov, World health organization (WHO) International Clinical Trials Registry Platform (ICTRP) and Cochrane COVID registry were assessed till May 11th 2020. Study selection Studies on any intervention based randomized controlled trials (RCTs), prospective clinical studies on SARS-CoV-2 in patients [&ge;]18 years of age. Studies on autopsy series, preclinical studies, diagnostic methods, mathematical modelling, epidemiology and health services research, pediatric populations were excluded. Data extraction The data was extracted by two authors independently into pre-defined forms based on the SPIRIT 2013 checklist. The data was extracted on various domains such as trial number, study title, abstract of the study, interventions assessed, sample size, phase of the study, study sponsor, primary endpoint assessed and country of study. Results The search resulted in 3242 ongoing studies of which 829 studies were included. There are 134 different drug-based interventions being assessed in 463 clinical trials as treatment options. Seventy-two studies assessed preventive options of which 53 are drug-based prophylaxis and 19 assessed vaccines. Herbal medicines are being assessed in 79 studies; convalescent plasma therapy in 56 studies; stem cell based interventions in 42 studies; anesthesia-based interventions in 31 studies, machine-based interventions in 24 studies, mental health- based interventions in18 studies, rehabilitation based interventions in 12 studies and miscellaneous interventions in 32 studies. China accounts for 35% of all ongoing clinical studies followed by USA 23%, France 7%, Spain 3.3%,Canada 2%, multi-country studies account only for 1.5% (13) and other countries together account for 28%.Amongst the 463 studies assessing drug-based treatment options, studies that are funded by federal and academic institutions are 79.6%, pharmaceutical company funded studies are 15.11% and no funding information is available in 5.10%. The definitive outcomes like mortality are being assessed as primary outcome in 22.8% of the studies only and need for ventilator in 6.2% of the studies. Rest of the studies has primary outcomes such as clinical recovery (15.9%), viral clearance(17.4%), time to recovery (10.1%), oxygen improvement (5.6%), ICU admission (1.9%), lab and imaging(6.4%), adverse effects (5.3%) and symptom reduction(1.5%),no outcome reported(6.2%) which account for 71% of the studies. Amongst the pharmaceutical company funded drug-based studies, only 20% of the studies had mortality as the primary outcome. Only 5.5% of the ongoing clinical trials are specifically designed to assess the most vulnerable population like elderly, patients with comorbidities and cancer. The most common intervention being tested against COVID-19 are antimalarial medications with 105 clinical studies. Hydroxychloroquine is the most common drug being tested with 83 ongoing studies. Conclusion Multiple intervention based clinical studies against SARS-CoV-2 are being performed throughout the world with a high concentration of clinical trials in the developed world. There is a high concern that most of the studies maybe repetitive; elderly and patients with comorbidities are being underrepresented; definite endpoints like mortality are being assessed in only one-fifth of the studies.",26/05/2020,10.1101/2020.05.24.20112169,Bhanu Prasad Venkatesulu,Henry Ford Hospital,medrxiv,0,0
28,8042,Improved detection of antibody against SARS-CoV-2 by microsphere-based antibody assay,"Objective: Currently available COVID-19 antibody tests using enzyme immunoassay (EIA) or immunochromatographic assay have variable sensitivity and specificity. Here, we developed and evaluated a novel microsphere-based antibody assay (MBA) for the detection of immunoglobulin G (IgG) against SARS-CoV-2 nucleoprotein (NP) and spike protein receptor binding domain (RBD). Method: We developed a microsphere-based assay (MBA) to determine the levels of IgG against SARS-CoV-2 NP and spike RBD. The seropositive cut-off mean fluorescent intensity (MFI) was set using a cohort of 294 anonymous serum specimens collected in 2018. The specificity was assessed using serum specimens collected from organ donors or influenza patients before 2020. Seropositive rate was determined among patients with COVID-19. Time-to-seropositivity and signal-to-cutoff (S/CO) ratio were compared between MBA and EIA. Results: MBA had a specificity of 100% (93/93; 95% confidence interval [CI], 96-100%) for anti-NP IgG and 98.9% (92/93; 95% CI 94.2-100%) for anti-RBD IgG. The MBA seropositive rate for convalescent serum specimens of COVID-19 patients were 89.8% (35/39) for anti-NP IgG and 79.5% (31/39) for anti-RBD IgG. The time-to-seropositivity was shorter with MBA than that of EIA. When compared with EIA, MBA could better differentiate between COVID-19 patients and negative controls with significantly higher S/CO ratio for COVID-19 patients and lower S/CO ratio with negative controls. MBA also had fewer specimens in the equivocal range (S/CO 0.9-1.1) than EIA. Conclusion: MBA is robust and simple, and is suitable for clinical microbiology laboratory for the accurate determination of anti-SARS-CoV-2 antibody for retrospective diagnosis, serosurveillance, and vaccine trials.",26/05/2020,10.1101/2020.05.26.20113191,Kelvin Kai-Wang To,University of Hong Kong,medrxiv,0,0
29,8102,The Potential Impact of Intensified Community Hand Hygiene Interventions on Respiratory tract Infections: A Modelling Study,"Increased hand hygiene amongst the general public has been widely promoted as one of the most important non-pharmaceutical interventions for reducing transmission during the ongoing COVID-19 pandemic and is likely to continue to play a key role in long-term efforts to suppress transmission before a vaccine can be deployed. For other respiratory tract infections community hand hygiene interventions are supported by evidence from randomised trials, but information on how effectiveness in reducing transmission scales with achieved changes in hand hygiene behaviour is lacking. This information is of critical importance when considering the potential value of substantially enhancing community hand hygiene frequency to help suppress COVID-19. Here, we developed a simple model-based framework for understanding the key determinants of the effectiveness of changes in hand hygiene behaviour in reducing transmission and use it to explore the potential impact of interventions aimed at achieving large-scale population-wide changes in hand hygiene behaviour. Our analyses show that the effect of hand hygiene is highly dependent on the duration of viral persistence on hands and that hand washing needs to be performed very frequently or immediately after hand contamination events in order to substantially reduce the probability of infection. Hand washing at a lower frequency, such as every 30 minutes or with a delay of 15 minutes after contamination events, may be adequate to reduce the probability of infection when viral survival on hands is longer, such as when hands are contaminated with mucus. Immediate hand washing after contamination is more effective than hand washing at fixed-time intervals even when the total number of hand washing events is similar. This event-prompted hand washing strategy is consistently more effective than fixed-time strategy regardless of hand contamination rates and should be highlighted in hand hygiene campaigns.",27/05/2020,10.1101/2020.05.26.20113464,Thi Mui Pham,Julius Center for Health Sciences and Primary Care of the UMC Utrecht,medrxiv,0,0
30,8534,A SYSTEMATIC ANALYSIS OF THE TIME COURSE TO DEVELOP TREATMENTS FOR COVID-19,"ABSTRACT BACKGROUND. The spread of COVID-19 from Wuhan China, has been alarmingly rapid. Epi-demiologic techniques succeeded in containing the disease in China, but efforts have not been as suc-cessful in the rest of the World, with a total of 29,155,581 confirmed cases of COVID-19, including 926,544 deaths worldwide as of September 15, 2020. Projections are for continued new infections and deaths if no effective therapeutic interventions can be initiated over the next several months. We per-formed a systematic review to determine the potential time course for development of treatments and vaccines, focusing on availability now and continuing in the last half of 2020. METHODS Clinical Trials: We reviewed up-to-date information from several sources to identify potential treatments for COVID-19: The Reagan-Udall Expanded Access Navigator COVID-19 Treatment Hub was used to track the efforts of companies to develop agents. We focused on trials completed as of September 1, 2020 on identified agents We used several different sources: (A) covid-trials.org, then validated results on (B) clinicaltrials.gov and the (C) World Health Organization's Inter-national Clinical Trials Registry Platform (WHO ICTRP). We excluded studies which were clearly ob-servational, with no randomization, control, or comparison group. We further set a cutoff of 100 for numbers of subjects, since smaller trial size could lack statistical power to establish superiority of the intervention over the control. Publications: We searched for published trial results on pubmed.gov and on medRxiv, the preprint serv-er, and used a targeted Google search to find announcements of unpublished trial results RESULTS Clinical Trials in Recruitment: As of our cutoff date of April 1, 2020, we found 409 trials meeting our minimum requirement of 100 subjects. The WHO Solidarity megatrial for hospitalized patients was launched in over 100 countries, actively comparing hydroxychloroquine (HCQ), lopanovir/ritonavir (LPV/r) alone and in combination with interferon beta-1, and remdesivir. The LPV/r alone and HCQ arms have already been discontinued. Of these, only 9 were conducted on outpatients. A few vaccine trials are hoping to complete Phase 3 enrollment by the end of the third quarter 2020, but a prolonged follow-up of patients will likely be required. Clinical trials Completed: As of September 1, 2020, there were 231 trials reporting completion, Of these, only 59 studies enrolled 100 or more subjects. There were 34 trials in hospitalized patients, 9 di-rected at outpatients, and 8 prevention studies, Published Data: As of September 1, 2020 we found 70 publications reporting findings in human studies on 13 classes of drugs and on 6 vaccines. There were 33 randomized placebo or active control studies; the rest were retrospective observational. Only seven publications dealt with outpatient care, the rest all in hospitalized patients. Available Treatments. At this time, remdesivir and convalescent plasma have been granted emergency use authorization in the U.S.A., solely for hospitalized patients. There is also support for glucocorticoid treatment of the COVID-19 respiratory distress syndrome. No treatments or prophylaxis are offered for outpatients. CONCLUSION. COVID-19 is propagated primarily by infected ambulatory individuals. There have been no options brought forward for prevention and non-hospital treatment with only a few random-ized, controlled outpatient studies expected to yield results in time to impact on the continuing pan-demic by the end of 2020. It will be necessary for public health authorities to make hard decisions, with limited data, to prevent the continued spread of the disease. The choices will be hardest when dealing with possible early release of safe and effective vaccines which would, of course, be of greatest benefit to the World's population. Keywords: Coronavirus, COVID-19, SARS-Cov-2, remdesivir, hydroxychloroquine, favipiravir",18/09/2020,10.1101/2020.05.27.20115238,Marc Rendell,The Rose Salter Medical Research Foundation,medrxiv,0,0
31,8625,Repurposed prophylaxis strategies for COVID-19: a systematic review,"Introduction Efficient therapeutic strategies are needed to counter the COVID-19 pandemic, caused by the SARS- CoV-2 virus. In a context where specific vaccines are not yet available, the containment of the pandemic would be facilitated with efficient prophylaxis. Methods We screened several clinical trials repositories and platforms in search of the prophylactic strategies that are investigated against COVID-19 in late April 2020. Results Up to April 27, 2020, we found 68 clinical trials targeting medical workers (n=43, 63%), patients relatives (n=16, 24%) or individuals at risk of severe COVID-19 (n=5, 7%). (Hydroxy)chloroquine was the most frequently evaluated treatment (n=46, 68%), before BCG vaccine (n=5, 7%). Sixty-one (90%) clinical trials were randomized with a median of planned inclusions of 600 (IQR 255-1515). Conclusion The investigated prophylaxis strategies cover both pre- and post-exposure prophylaxis and study numerous immune enhancers and antivirals, although most research efforts are focused on (hydroxy)chloroquine.",03/06/2020,10.1101/2020.05.30.20117937,Nathan Peiffer-Smadja,"Universite de Paris, IAME, INSERM, F-75018, Paris, France; Department of Infectious and Tropical Diseases, Assistance Publique - Hopitaux de Paris, Bichat- Clau",medrxiv,0,0
32,9054,Serological Assays Estimate Highly Variable SARS-CoV-2 Neutralizing Antibody Activity in Recovered COVID19 Patients,"The development of neutralizing antibodies (nAb) against SARS-CoV-2, following infection or vaccination, is likely to be critical for the development of sufficient population immunity to drive cessation of the COVID19 pandemic. A large number of serologic tests, platforms and methodologies are being employed to determine seroprevalence in populations to select convalescent plasmas for therapeutic trials, and to guide policies about reopening. However, tests have substantial variability in sensitivity and specificity, and their ability to quantitatively predict levels of nAb is unknown. We collected 370 unique donors enrolled in the New York Blood Center Convalescent Plasma Program between April and May of 2020. We measured levels of antibodies in convalescent plasma using commercially available SARS-CoV-2 detection tests and in-house ELISA assays and correlated serological measurements with nAb activity measured using pseudotyped virus particles, which offer the most informative assessment of antiviral activity of patient sera against viral infection. Our data show that a large proportion of convalescent plasma samples have modest antibody levels and that commercially available tests have varying degrees of accuracy in predicting nAb activity. We found the Ortho Anti-SARS-CoV-2 Total Ig and IgG high throughput serological assays (HTSAs), as well as the Abbott SARS-CoV-2 IgG assay, quantify levels of antibodies that strongly correlate with nAb assays and are consistent with gold-standard ELISA assay results. These findings provide immediate clinical relevance to serology results that can be equated to nAb activity and could serve as a valuable roadmap to guide the choice and interpretation of serological tests for SARS-CoV-2.",09/09/2020,10.1101/2020.06.08.20124792,Larry L Luchsinger,New York Blood Center,medrxiv,0,0
33,9209,Pre exposure Hydroxychloroquine use is associated with reduced COVID19 risk in healthcare workers - a Retrospective cohort,"ABSTRACT BACKGROUND OF STUDY While several trials are ongoing for treatment of COVID-19, scientific research on chemoprophylaxis is still lacking even though it has potential to flatten the curve allowing us time to complete research on vaccines. OBJECTIVES OF THE STUDY To explore the potential of HCQ as a pre-exposure prophylaxis for COVID 19 in health care workers in a tertiary care hospital. MATERIALS & METHODS We have conducted a retrospective cohort study among 106 Health Care Workers (HCW) exposed to COVID-19 patients, at a tertiary care hospital in India where there was an abrupt cluster outbreak within on duty personnel. HCWs who had voluntarily taken hydroxychloroquine (HCQ) prior to exposure were considered one cohort while those who had not were considered to be the Control group. All participants with a verifiable high risk contact history were tested for COVID-19 by RT-PCR. RESULTS The two cohorts were comparable in terms of age, gender, co-morbidities and exposure. The primary outcome was incidence rates of RT-PCR positive COVID-19 infection amongst HCQ users and Controls. In this retrospective cohort study, 106 healthcare workers were examined of whom 54 were HCQ users and rest were not. The comparative analysis of incidence of infection between the two groups demonstrated that voluntary HCQ usage was associated with lesser likelihood of developing SARS-CoV-2 infection (4 out of 54 HCW), compared to those who were not on it (20 out of 52 HCW), {chi}2 =14.59, p<0.001. None of the HCQ users noted any serious adverse effects. CONCLUSIONS This study demonstrated that voluntary HCQ consumption as pre-exposure prophylaxis by HCWs is associated with a statistically significant reduction in risk of SARS-CoV-2. These promising findings therefore highlight the need to examine this association in greater detail among a larger sample using Randomised Controlled Trials (RCT). KEYWORDS : Covid19, hydroxychloroquine, pre-exposure prophylaxis, healthcare workers",01/10/2020,10.1101/2020.06.09.20116806,Anita Nandi,Medical College Kolkata,medrxiv,0,0
34,9467,Global research trend in the treatment of the new Coronavirus diseases (COVID-19) : bibliometric analysis.,"The Coronavirus 2019 (COVID-19) pandemic has caused worldwide concern and has become a major medical problem. Vaccines and therapeutics are important interventions for the management of this outbreak. This study aims to used bibliometric methods to identify research trends in the domain of therapeutics and vaccines to cure patients with COVID-19 since the beginning of the pandemic. The Web of Science Core Collection database was retrieved for articles on therapeutic approaches to coronavirus disease management published between January 1, 2020 and May 20, 2020. Identified and analyzed the data included title, corresponding author, language, publication time, publication type, research focus. A total of 1569 articles on coronavirus therapeutic means from 84 countries were published in 620 journals. We note the remarkable progressive increase in the number of publications related to research on therapies and vaccines for COVID-19. The United States provided the largest number of articles (405), followed by China (364). Journal of Medical Virology published most of them (n=40). 1005 (64.05%) were articles, 286 (18.23%) were letters, 230 (14.66%) were reviews. The terms ""COVID- 19"" or ""SARS-CoV-2"" or ""Coronavirus"" or ""hydroxychloroquine"" or ""chloroquine"" or ""2019-nCOV"" or ""ACE2"" or ""treatment"" or ""remdesivir"" or ""pneumonia"" were most frequently used, as shown in the density visualization map. A network analysis based on keyword co-occurrence revealed five distinct types of studies: clinical, biological, epidemiological, pandemic management, and therapeutics (vaccines and treatments). COVID-19 is a major disease that has had an impact on international public health at the global level. Several avenues for treatment and vaccines have been explored. Most of them focus on older drugs used to treat other diseases that have been effective for other types of coronaviruses. There is a discrepancy in the results obtained from the studies of the drugs included in this study. Randomized clinical trials are needed to evaluate older drugs and develop new treatment options.",14/06/2020,10.1101/2020.06.13.20122762,Maxime Descartes Mbogning Fonkou,Aix Marseille Universite,medrxiv,0,0
