,ID,title,abstract,date,doi,author_corresponding,author_corresponding_institution,source,eligible,new
80,15292,Evaluating the Efficacy of COVID-19 Vaccines,"A large number of studies are being conducted to evaluate the efficacy and safety of candidate vaccines against novel coronavirus disease-2019 (COVID-19). Most Phase 3 trials have adopted virologically confirmed symptomatic COVID-19 disease as the primary efficacy endpoint, although laboratory-confirmed SARS-CoV-2 is also of interest. In addition, it is important to evaluate the effect of vaccination on disease severity. To provide a full picture of vaccine efficacy and make efficient use of available data, we propose using SARS- CoV-2 infection, COVID-19, and severe COVID-19 as dual or triple primary endpoints. We demonstrate the advantages of this strategy through realistic simulation studies. Finally, we show how this approach can provide rigorous interim monitoring of the trials and efficient assessment of the durability of vaccine efficacy.",05/10/2020,10.1101/2020.10.02.20205906,Dan-Yu Lin,"University of North Carolina, Chapel Hill",medrxiv,0,1
81,15296,Safety and efficacy of pharmacotherapy used for the management of COVID 19: A systematic review and meta-analysis of randomized control trials,"Background: COVID-19 is a novel coronavirus, which is highly contagious and a threat to human health, spreading across nearly 235 countries, affecting 33.8 million and causing 1.01 million fatalities as of 22 September 2020. Researchers have invested tremendous efforts to develop vaccines or effective drug therapy but have not yet been fruitful. Hence, we planned to conduct this systematic review and meta-analysis to supplement the readers with comprehensive data and credible information on the safety and efficacyof essential pharmacotherapy during the pharmacological management of COVID-19. Methods: Theprotocol will be designed based on the updated PRISMA-P 2015 guidelines. An elaborate search of electronic databases such as PubMed/Medline, Web of Science, Scopus, The Cochrane Library, ClinicalTrials.gov, Google Scholar, Medrxiv and other potential databases for articles published during January 2020 to 10 October 2020 is planned to be conducted. Following this,randomized control trials published in English language that assess the safety and efficacy of pharmacotherapy versusplacebo or standard of care or usual care will be evaluated for inclusion. The primary outcomes will include time to clinical recovery and the probability for the negative conversion of COVID-19. Secondary outcomes will quantifythe proportion of patients relieved of symptoms, the all-cause mortality, morbidity, detection of viral RNA, time needed to achieve a negative viral load, ordinal scale changes, ventilatorand oxygen requirements,length of hospital stayand the incidence of adverse and serious adverse events.RevMan V.5.3 computer software packages will be utilised to conduct an accurate statistical analysis of the study. Thebinary random-effects model will be used at a 95 % confidence interval to estimate the weighted effect size ofdichotomous data and continuous data studies. The results of statistical analysis will be considered statistically significant whena p-value <0.05 is attained. Results: Selected studies will be used to evaluate the safety and efficacy of pharmacotherapy used during the management of the novel COVID-19. Conclusion: This study will be a qualitative and quantitative pool of comprehensive evidence regarding the safety and efficacy of pharmacotherapy on COVID-19.",06/10/2020,10.1101/2020.10.02.20206045,Madhan Ramesh,"Professor & Head Department of Pharmacy Practice, JSS College of pharmacy JSS Academy of Higher Education and Research, SS Nagar, Mysuru-570015",medrxiv,0,1
82,15314,An open-label prospective observational study of antiandrogen and non-antiandrogen early pharmacological approaches in females with mild-to-moderate COVID-19. The Pre-AndroCoV Female Trial.,"Background: While COVID-19 remains largely unclear and mortality continues to raise, early effective approaches prior to complications lack, as well as researches for characterization and therapeutical potential options in actual early COVID-19. Although females seem to be less affected than females, hyperandrogenic (HA) phenotype, like polycystic ovary syndrome (PCOS), idiopathic hirsutism, congenital adrenal hyperplasia (CAH) female androgenetic alopecia (AGA), or idiopathic HA may be at higher risk due to its inherent enhanced androgenic activity. The present study aimed to evaluate the effects of any early pharmacological approach to females diagnosed with COVID-19 before seven days of symptoms, as well as investigate whether HA is an additional risk factor in this population. Materials and methods: Females with symptoms for less than seven days confirmed for COVID-19 through positive real-time polymerase chain reaction (rtPCR-SARS-CoV-2) were classified and divided as non-HA, HA, and HA using spironolactone (HA-spiro) groups. Patients were questioned for baseline characteristics, 23 different diseases, 44 drug classes and vaccines, 28 different symptoms, and eight different parameters to measure COVID-19 related clinical outcomes. Treatment was then provided, including azithromycin 500mg/day for five days in all cases, associated with hydroxychloroquine 400mg/day for five days, nitazoxanide 500mg twice a day for six days, or ivermectin 0.2mg/kg/day por three days, and optionally spironolactone 100mg twice a day until cure. Patients were assessed for COVID-19 clinical course, clinical and viral duration, and disease progression. Results: In total, 270 females were enrolled, including 195, 67, and eight in non-HA, HA, and HA-spiro groups, respectively. Prevailing symptoms were anosmia (71.1%), ageusia (67.0%), headache (48.1%), myalgia (37.4%), dry cough (36.3%), nasal congestion or rhinorrhea (34.1%), fatigue (33.3%), weakness (29.5%), hyporexia (27.8%), thoracic pain (24.8%), diarrhea (24.1%) and dizziness (21.5%). Earliest symptoms (days) were dizziness (1.0 +- 0.2 day), abdominal pain (1.1 +- 0.3); conjunctival hyperemia (1.1 +- 0.5), nasal congestion or rhinorrhea (1.2 +- 0.5), headache (1.2 +- 0.5), dry cough (1.2 +- 61617; 0.5), myalgia (1.2 +- 0.4), nauseas (1.3 +- 0.5) and weakness (1.3 +- 0.5). Time-to-treat, positive rtPCR, and duration of symptoms with and without anosmia and ageusia were significantly lower in HA-spiro than non-HA, HA, and overall non-users. Time-to-treat was similar while all duration of symptoms and positive rtPCR-SARS-CoV-2 were significantly shorter in non-HA than HA. Spironolactone users were more likely to be asymptomatic than non-users during COVID-19. Fewer non-HA than HA females were affected by anosmia, ageusia, dry cough, fatigue, weakness and hyporexia. Ageusia, weakness and myalgia lasted shorter in non-HA than HA. None of the patients needed hospitalization or any other COVID-19 complication. Conclusions: A sensitive, early detection of COVID-19 followed by a pharmaceutical approach with different drug combinations yielded irrefutable differences compared to sex-, age-, body mass index (BMI)-, and disease-matched non-treated controls in terms of clinical outcomes, ethically disallowing placebo-control randomized clinical trials in the early stage of COVID-19 due to the marked improvements. HA females presented more severe and prolonged clinical manifestations, although none progressed to worse outcomes. Spironolactone mitigated the additional risks due to HA.",06/10/2020,10.1101/2020.10.05.20206870,Flavio A Cadegiani,Federal University of Sao Paulo,medrxiv,0,1
83,15482,A high-throughput microfluidic nano-immunoassay for detecting anti-SARS-CoV-2 antibodies in serum or ultra-low volume dried blood samples,"Novel technologies are needed to facilitate large-scale detection and quantification of SARS-CoV-2 specific antibodies in human blood samples. Such technologies are essential to support seroprevalence studies, vaccine clinical trials, and to monitor quality and duration of immunity. We developed a microfluidic nano-immunnoassay for the detection of anti-SARS-CoV-2 IgG antibodies in 1024 samples per device. The method achieved a specificity of 100% and a sensitivity of 98% based on the analysis of 289 human serum samples. To eliminate the need for venipuncture, we developed low-cost, ultra-low volume whole blood sampling methods based on two commercial devices and repurposed a blood glucose test strip. The glucose test strip permits the collection, shipment, and analysis of 0.6 L whole blood easily obtainable from a simple fingerprick. The nano-immunoassay platform achieves high-throughput, high sensitivity and specificity, negligible reagent consumption, and a decentralized and simple approach to blood sample collection. We expect this technology to be immediately applicable to current and future SARS-CoV-2 related serological studies and to protein biomarker diagnostics in general.",09/10/2020,10.1101/2020.10.07.20208280,Sebastian J. Maerkl,Ecole Polytechnique Federale de Lausanne,medrxiv,0,1
84,33038433,"COVID-19: discovery, diagnostics and drug development.","An epidemic of acute respiratory syndrome (Covid-19) started in humans in Wuhan in 2019, and became a pandemic. Groups from China Identified and sequenced the virus responsible for COVID-19, named SARS-CoV-2, and determined that it was a novel coronavirus (CoV) that shared high sequence identity with bat- and pangolin-derived SARS-like CoVs, suggesting a zoonotic origin. SARS-CoV-2 is a member of Coronaviridae, a family of enveloped, positive-sense, single-stranded RNA viruses that infect a broa",10/10/2020,10.1016/j.jhep.2020.09.031,Tarik Asselah,"Paris University, CRI, INSERM UMR 1149, Department of Hepatology, AP-HP H..pital Beaujon, Clichy, France. Electronic address: Tarik.asselah@aphp",pubmed,0,1
85,33037772,Novel use of an old compound? Urologist-led BCG-vaccine trials in the prevention of COVID-19.,"Amidst the ongoing coronavirus (COVID-19) pandemic, there is a hope for a vaccine to provide effective herd immunity for everyone's lives to return to normal. Several COVID-19-vaccines are under way, some of which have recently entered phase III trials. Meanwhile, an age-old treatment in daily urologic practice may find a novel role in the world's battle against COVID-19, until a COVID-19 specific vaccine is developed.",10/10/2020,10.1111/bju.15267,Alexandre R Zlotta,"Department of Surgery, Urology, Sinai Health System, Toronto, Canada",pubmed,0,1
86,33036833,Theoretical novel COVID-19 vaccination risk of rare and severe adverse events versus COVID-19 mortality.,"COVID-19 continues pandemic and researchers and companies are racing to develop effective vaccines with currently (September 2020) over 320 vaccine candidates, 32 of which are in clinical trials that plan to enroll &gt;280,000 volunteers from &gt;470 sites in 34 different countries. Vaccines are given to healthy multitudes and for this reason, they must adhere to high safety standards. Many question the safety of vaccines developed with the current alacrity, commonly citing potential hypothetica",10/10/2020,10.1016/j.earlhumdev.2020.105212,Victor Grech,"Mater Dei Hospital, Malta. Electronic address: victor.e.grech@gov",pubmed,0,1
87,33035262,Preparedness needs research: How fundamental science and international collaboration accelerated the response to COVID-19.,"The first cluster of patients suffering from coronavirus disease 2019 (COVID-19) was identified on December 21, 2019, and as of July 29, 2020, severe acute respiratory syndrome coronavirus 2 (SARS-CoV-2) infections have been linked with 664,333 deaths and number at least 16,932,996 worldwide. Unprecedented in global societal impact, the COVID-19 pandemic has tested local, national, and international preparedness for viral outbreaks to the limits. Just as it will be vital to identify missed oppor",09/10/2020,10.1371/journal.ppat.1008902,Cormac M Kinsella,"Laboratory of Experimental Virology, Department of Medical Microbiology and Infection Prevention, Amsterdam UMC, University of Amsterdam, Amsterdam, the Netherlands",pubmed,0,1
88,33034338,Computer-aided prediction and design of IL-6 inducing peptides: IL-6 plays a crucial role in COVID-19.,"Interleukin 6 (IL-6) is a pro-inflammatory cytokine that stimulates acute phase responses, hematopoiesis and specific immune reactions. Recently, it was found that the IL-6 plays a vital role in the progression of COVID-19, which is responsible for the high mortality rate. In order to facilitate the scientific community to fight against COVID-19, we have developed a method for predicting IL-6 inducing peptides/epitopes. The models were trained and tested on experimentally validated 365 IL-6 indu",09/10/2020,10.1093/bib/bbaa259,Anjali Dhall,"Department of Computational Biology, Indraprastha Institute of Information Technology, New Delhi, India",pubmed,0,1
89,33032740,Influenza Vaccination to Reduce Cardiovascular Morbidity and Mortality in Patients With COVID-19: JACC State-of-the-Art Review.,"Viral respiratory infections are risk factors for cardiovascular disease (CVD). Underlying CVD is also associated with an increased risk of complications following viral respiratory infections, including increased morbidity, mortality, and health care utilization. Globally, these phenomena are observed with seasonal influenza and with the current coronavirus disease 2019 (COVID-19) pandemic. Persons with CVD represent an important target population for respiratory virus vaccines, with capacity d",11/10/2020,10.1016/j.jacc.2020.08.028,Bahar Behrouzi,"Cardiovascular Division, Department of Medicine, Women's College Hospital, Toronto, Ontario, Canada",pubmed,0,1
90,33030329,[SARS coronavirus-2 vaccines: options and state-of-the-art].,"Since the first reports in mid-January of a serious new viral respiratory infection, COVID-19, and the identification of SARS-CoV-2 as the cause of this disease, researchers work intensely on developing a vaccine that can protect individuals against serious disease and that can limit the spread of the virus. Vaccine developers are using a range of platform technologies to do this, each with advantages and disadvantages. Close to 30 vaccines are now in clinical testing. The first results are enco",08/10/2020,,Anke L W Huckriede,"Universitair Medisch Centrum Groningen/Universiteit Groningen, afd. Medische Microbiologie en Infectiepreventie, Groningen",pubmed,0,1
91,33029657,Antibody response to multiple antigens of SARS-CoV-2 in patients with diabetes: an observational cohort study.,The aim of the study was to characterise the humoral response against severe acute respiratory syndrome coronavirus 2 (SARS-CoV-2) in patients with diabetes. Demonstrating the ability to mount an appropriate antibody response in the presence of hyperglycaemia is relevant for the comprehension of mechanisms related to the observed worse clinical outcome of coronavirus disease 2019 (COVID-19) pneumonia in patients with diabetes and for the development of any future vaccination campaign to prevent ,10/10/2020,10.1007/s00125-020-05284-4,Vito Lampasona,"San Raffaele Diabetes Research Institute, IRCCS Ospedale San Raffaele, Milan, Italy",pubmed,0,1
93,33022727,[Vaccines for adults: an update].,"Vaccination practices in Germany are driven by scientific developments and a complex regulatory environment. Some important developments in 2019/20 are described here: Work-related vaccination recommendations for measles, rubella, and chickenpox have been streamlined and expanded. In addition, measles vaccination or documentation of immunity is now mandatory for employment at and attendance of many institutions, specifically including day care centers and schools. Owing to the shift of pneumococ",08/10/2020,10.1055/a-0982-8894,Ulrich Seybold,"Medizinische Klinik und Poliklinik IV, Sektion Klinische Infektiologie, Klinikum der Ludwig-Maximilians-Universit..t, M..nchen",pubmed,0,1
94,33022293,Clinical trial protocols of repurposed prophylaxis for COVID-19: a review.,"Efficient therapeutic strategies are needed to counter the COVID-19 pandemic, caused by the SARS-CoV-2 virus. In a context where specific vaccines are not yet available, the containment of the pandemic would be facilitated with efficient prophylaxis. We screened several clinical trials repositories and platforms in search of the prophylactic strategies being investigated against COVID-19 in July 2020. Up to July 5, 2020, only one clinical trial result was published, although we found 112 clinica",09/10/2020,10.1016/j.medmal.2020.09.013,Erwan Sallard,"..cole Normale Sup..rieure de Paris, 45 Rue D'Ulm, 75005 Paris, France",pubmed,0,1
95,33015676,Preparing the public for COVID-19 vaccines: How can general practitioners build vaccine confidence and optimise uptake for themselves and their patients?,"The availability of a COVID-19 vaccine is being heralded as the solution to control the current COVID-19 pandemic, reduce the number of infections and deaths and facilitate resumption of our previous way of..life. The aim of this article is to provide a framework for primary care of what will be needed to optimise COVID-19 vaccine confidence and uptake in Australia once the vaccine prioritisation schedule and key target groups are known. While a number of vaccines are currently under development",07/10/2020,10.31128/AJGP-08-20-5559,Margie Danchin,"MBBS, PhD, FRACP, Associate Professor and David Bickart Clinician Scientist Fellow, Department of Paediatrics, The University of Melbourne, Vic",pubmed,0,1
96,33015109,What Can We Estimate From Fatality and Infectious Case Data Using the Susceptible-Infected-Removed (SIR) Model? A Case Study of Covid-19 Pandemic.,"The rapidly spreading Covid-19 that affected almost all countries, was first reported at the end of 2019. As a consequence of its highly infectious nature, countries all over the world have imposed extremely strict measures to control its spread. Since the earliest stages of this major pandemic, academics have done a huge amount of research in order to understand the disease, develop medication, vaccines and tests, and model its spread. Among these studies, a great deal of effort has been invest",06/10/2020,10.3389/fmed.2020.556366,Semra Ahmetolan,"Department of Mathematics, Faculty of Science and Letters, Istanbul Technical University, Istanbul, Turkey",pubmed,0,1
97,33013255,Screening of FDA Approved Drugs Against SARS-CoV-2 Main Protease: Coronavirus Disease.,"At the end of December 2019, a new strain of coronavirus was identified in the Wuhan city of Hubei province in China. Within a shorter period of time, an unprecedented outbreak of this strain was witnessed over the entire Wuhan city. This novel coronavirus strain was later officially renamed as COVID-19 (Coronavirus disease 2019) by the World Health Organization. The mode of transmission was human-to-human contact and hence resulted in a rapid surge across the globe where more than 24..million p",06/10/2020,10.1007/s10989-020-10115-6,Vijayakumar Balakrishnan,"S..o Carlos Institute of Physics (IFSC), University of S..o Paulo, Av. Joao Dagnone, 1100 - Jardim Santa Angelina, S..o Carlos, 13563-120 Brazil",pubmed,0,1
98,33012602,Ensemble forecast modeling for the design of COVID-19 vaccine efficacy trials.,"To rapidly evaluate the safety and efficacy of COVID-19 vaccine candidates, prioritizing vaccine trial sites in areas with high expected disease incidence can speed endpoint accrual and shorten trial duration. Mathematical and statistical forecast models can inform the process of site selection, integrating available data sources and facilitating comparisons across locations. We recommend the use of ensemble forecast modeling - combining projections from independent modeling groups - to guide in",09/10/2020,10.1016/j.vaccine.2020.09.031,Natalie E Dean,"Department of Biostatistics, University of Florida, Gainesville, FL, United States. Electronic address: nataliedean@ufl",pubmed,0,1
99,33012348,SARS-CoV-2 Vaccine Development: Current Status.,"In the midst of the severe acute respiratory syndrome coronavirus 2 pandemic and its attendant morbidity and mortality, safe and efficacious vaccines are needed that induce protective and long-lived immune responses. More than 120 vaccine candidates worldwide are in various preclinical and phase 1 to 3 clinical trials that include inactivated, live-attenuated, viral-vectored replicating and nonreplicating, protein- and peptide-based, and nucleic acid approaches. Vaccines will be necessary both f",09/10/2020,10.1016/j.mayocp.2020.07.021,Gregory A Poland,"Vaccine Research Group, Mayo Clinic, Rochester, MN. Electronic address: poland.gregory@mayo",pubmed,0,1
105,32997699,"Analysis of COVID-19 clinical trials: A data-driven, ontology-based, and natural language processing approach.","With the novel COVID-19 pandemic disrupting and threatening the lives of millions, researchers and clinicians have been recently conducting clinical trials at an unprecedented rate to learn more about the virus and potential drugs/treatments/vaccines to treat its infection. As a result of the influx of clinical trials, researchers, clinicians, and the lay public, now more than ever, face a significant challenge in keeping up-to-date with the rapid rate of discoveries and advances. To remedy this",07/10/2020,10.1371/journal.pone.0239694,Shray Alag,"The Harker School, San Jose, CA, United States of America",pubmed,0,1
107,32994572,COVID vaccine confidence requires radical transparency.,NA,05/10/2020,10.1038/d41586-020-02738-y,NA NA,NA,pubmed,0,1
114,32978611,COVID-vaccine results are on the way - and scientists' concerns are growing.,NA,05/10/2020,10.1038/d41586-020-02706-6,Smriti Mallapaty,NA,pubmed,0,1
163,32887954,Immunological considerations for COVID-19 vaccine strategies.,"The coronavirus disease 2019 (COVID-19) pandemic caused by severe acute respiratory syndrome coronavirus 2 (SARS-CoV-2) is the most formidable challenge to humanity in a century. It is widely believed that prepandemic normalcy will never return until a safe and effective vaccine strategy becomes available and a global vaccination programme is implemented successfully. Here, we discuss the immunological principles that need to be taken into consideration in the development of COVID-19 vaccine str",06/10/2020,10.1038/s41577-020-00434-6,Mangalakumari Jeyanathan,"McMaster Immunology Research Centre, McMaster University, Hamilton, ON, Canada",pubmed,0,1
167,32877397,[Vaccines: from the identification of the microorganism to marketing. How long does it take?],"The development of a vaccine, particularly one that can help against the recent pandemic, is a topic that has recently attracted public opinion. More than ninety vaccines are currently being developed against Sars-Cov2 by universities and companies around the world. They are protein-based vaccines, viral vector vaccines, DNA or RNA vaccines and inactivated or attenuated viral vaccines. The development of a vaccine starts from the identification and characterization of the microorganism that caus",07/09/2020,,Elisa Terracciano,"Scuola di Specializzazione in Igiene e Medicina Preventiva, Tor Vergata Universit.. degli Studi di Roma, Italia",pubmed,0,1
181,32846196,Prospect of SARS-CoV-2 spike protein: Potential role in vaccine and therapeutic development.,"The recent outbreak of the betacoronavirus SARS-CoV-2 has become a significant concern to public health care worldwide. As of August 19, 2020, more than 22,140,472 people are infected, and over 781,135 people have died due to this deadly virus. In the USA alone, over 5,482,602 people are currently infected, and more than 171,823 people have died. SARS-CoV-2 has shown a higher infectivity rate and a more extended incubation period as compared to previous coronaviruses. SARS-CoV-2 binds much more ",07/10/2020,10.1016/j.virusres.2020.198141,Subodh Kumar Samrat,"Wadsworth Center, New York State Department of Health, 120 New Scotland Ave, Albany, NY 12208, USA",pubmed,0,1
182,32845317,Large Simple Double-Blind Randomized Trials for the Rapid Assessment of the Effectiveness of COVID-19 Vaccines.,NA,06/10/2020,10.1093/infdis/jiaa456,Joerg Hasford,"Institute for Medical Information Processing, Biometry, and Epidemiology, University of Munich, Munich, Germany",pubmed,0,1
183,32845250,COVID-19: Prospective Challenges and Potential Vaccines.,"RNA viruses exhibit an extraordinary ability to evolve in a changing environment and to switch from animal hosts to humans. The ongoing COVID-19 pandemic, recognized as a respiratory disease, is an example of zoonotic transmission of the RNA virus known as SARS-CoV-2. The development and regulatory approval of a vaccine against SARS-CoV-2 pose multiple preventive and therapeutic challenges, especially during an ongoing pandemic. The review intended to examine the challenges and recent achievemen",15/09/2020,,Muhammad Shahid Nadeem,NA,pubmed,0,1
186,32840177,An industry update: the latest developments in therapeutic delivery covering May 2020.,"The present industry update covers the period 1-31 May 2020, with information sourced from company press releases, regulatory and patent agencies as well as scientific literature.",08/10/2020,10.4155/tde-2020-0085,Oliver C Steinbach,"Imagion Biosystems, Inc., 10355 Science Center Drive, San Diego, CA 92121, USA",pubmed,0,1
